District	Incumbent	Party	First elected	Result	Candidates
Arkansas 1	William J. Driver	Democratic	1920	Re-elected	William J. Driver (D) Unopposed
Arkansas 2	John E. Miller	Democratic	1930	Re-elected	John E. Miller (D) 92.1% Ira J. Mock (R) 7.9%
Arkansas 3	Claude Fuller	Democratic	1928	Re-elected	Claude Fuller (D) Unopposed
Arkansas 4	Effiegene Locke Wingo	Democratic	1930	Retired Democratic hold	William B. Cravens (D) Unopposed
Arkansas 5	Heartsill Ragon	Democratic	1922	Re-elected	Heartsill Ragon (D) 90.5% A. L. Barbour (R) 9.5%
Arkansas 6	David Delano Glover	Democratic	1928	Re-elected	David Delano Glover (D) Unopposed
