District	Incumbent	Party	First elected	Result	Candidates
Arkansas 1	William J. Driver	Democratic	1920	Re-elected	William J. Driver (D) Unopposed
Arkansas 2	Pearl Peden Oldfield	Democratic	1929	Retired Democratic hold	John E. Miller (D) Unopposed
Arkansas 3	Claude Fuller	Democratic	1928	Re-elected	Claude Fuller (D) Unopposed
Arkansas 4	Otis Wingo	Democratic	1912	Died in office Democratic hold	Effiegene Locke Wingo (D) Unopposed
Arkansas 5	Heartsill Ragon	Democratic	1922	Re-elected	Heartsill Ragon (D) Unopposed
Arkansas 6	David Delano Glover	Democratic	1928	Re-elected	David Delano Glover (D) Unopposed
