District	Incumbent	Party	First elected	Result	Candidates
Alabama 1	John McDuffie	Democratic	1918	Re-elected	John McDuffie (D) 99.7% Andrew Forsman (R) 0.3%
Alabama 2	J. Lister Hill	Democratic	1923	Re-elected	J. Lister Hill (D) Unopposed
Alabama 3	Henry B. Steagall	Democratic	1914	Re-elected	Henry B. Steagall (D) Unopposed
Alabama 4	Lamar Jeffers	Democratic	1921	Lost renomination Democratic hold	Sam Hobbs (D) 87.6% Charles R. Robinson (R) 12.4%
Alabama 5	Miles C. Allgood	Democratic	1922	Lost renomination Democratic hold	Joe Starnes (D) 75.2% J. C. Swan (R) 24.8%
Alabama 6	William B. Oliver	Democratic	1914	Re-elected	William B. Oliver (D) Unopposed
Alabama 7	William B. Bankhead	Democratic	1916	Re-elected	William B. Bankhead (D) 80.4% J. W. Dodd (I) 19.6%
