District	Incumbent	Party	First elected	Result	Candidates
Louisiana 1	Bob Livingston	Republican	1977	Re-elected	Bob Livingston (R) Unopposed
Louisiana 2	Lindy Boggs	Democratic	1973	Re-elected	Lindy Boggs (D) Unopposed
Louisiana 3	Billy Tauzin	Democratic	1980	Re-elected	Billy Tauzin (D) Unopposed
Louisiana 4	Buddy Roemer	Democratic	1980	Re-elected	Buddy Roemer (D) Unopposed
Louisiana 5	Jerry Huckaby	Democratic	1976	Re-elected	Jerry Huckaby (D) Unopposed
Louisiana 6	Henson Moore	Republican	1974	Re-elected	Henson Moore (R) Unopposed
Louisiana 7	John Breaux	Democratic	1972	Re-elected	John Breaux (D) Unopposed
