Year	Mens singles	Womens singles	Mens doubles	Womens doubles	Mixed doubles
2012	Chen Yuekun	Sun Yu	Lee Sheng-mu Tsai Chia-hsin	Eom Hye-won Jang Ye-na	Tontowi Ahmad Lilyana Natsir
2011	Lee Hyun-il	Wang Shixian	Chai Biao Guo Zhendong	Jung Kyung-eun Kim Ha-na	Tontowi Ahmad Lilyana Natsir
2010	Lee Chong Wei	Li Xuerui	Ko Sung-hyun Yoo Yeon-seong	Cheng Wen-hsing Chien Yu-chin	Tontowi Ahmad Lilyana Natsir
2009	Lee Chong Wei	Wang Yihan	Koo Kien Keat Tan Boon Heong	Du Jing Yu Yang	He Hanbin Yu Yang
2008	Taufik Hidayat	Zhou Mi	Koo Kien Keat Tan Boon Heong	Cheng Shu Zhao Yunlei	Xu Chen Zhao Yunlei
2007	Chen Jin	Xie Xingfang	Koo Kien Keat Tan Boon Heong	Gao Ling Huang Sui	Xie Zhongbo Zhang Yawen
