District	Incumbent	Party	First elected	Result	Candidates
North Carolina 2	Lawrence H. Fountain	Democratic	1952	Re-elected	Lawrence H. Fountain (D) Unopposed
North Carolina 4	Nick Galifianakis	Democratic	1966	Re-elected	Nick Galifianakis (D) 52.4% Jack Hawke (R) 47.6%
North Carolina 5	Wilmer Mizell	Republican	1968	Re-elected	Wilmer Mizell (R) 58.1% James G. White (D) 41.9%
North Carolina 8	Earl B. Ruth	Republican	1968	Re-elected	Earl B. Ruth (R) 56.1% H. Clifton Blue (D) 43.9%
North Carolina 9	Charles R. Jonas	Republican	1952	Re-elected	Charles R. Jonas (R) 66.6% Cy N. Bahakel (D) 33.4%
