Task No.	Day announced	Description	Options	Viewers selection	Result
3	Day 45 (May 6, 2008)	Shy must drive which male housemate mad?	Ejay, Alex, Nan	Nan	Completed
4	Day 46 (May 7, 2008)	Shy must hide which housemate's possessions?	Valerie, Nicole, Alex	Nicole	Completed
5	Day 47 (May 8, 2008)	Which housemate must Shy take as her best friend?	Beauty, Ejay, Alex	Beauty	Completed
7	Day 51 (May 12, 2008)	Which housemate should the House Players amuse?	Priscilla, Valerie, Alex, Ejay	Ejay	Failed
9	Day 54 (May 15, 2008)	To which housemate should Mikan open up?	Priscilla, Rona, Valerie	Rona	Completed
