Country	Name	Network	Premiere	Host(s)	Judges	Seasons and Winners
Afghanistan	Afghan's Got Talent	1TV	2013	Mukthar Lashkari	TBA	Season 1, 2013: Upcoming season
Belgium	Supertalent in Vlaanderen (Dutch)	VIER	15 March 2007	Dré Steemans Ann Van Elsen	Paul Jambers Martine Prenen Gert Verhulst	Season 1, 2007: Triple E (Sister's Trio)
Belgium	Belgium's Got Talent (French)	RTL-TVi	10 September 2012	Julie Taton Jean-Michel Zecca	Maureen Dor Carlos Vaquera Paul Ambach	Season 1, 2012: 2 Mad (Dance troupe)
Kazakhstan	Жұлдызды Сәт Zhuldyzdy Set	Kazakhstan-1	11 May 2013	Unknown	Unknown	Season 1, 2013: Current season
Moldova	Moldova are talent	Prime	11 October 2013	Mircea Marco Adrian Ursu	Nicu Țărnă Tania Cerga Mihai Munteanu	Season 1, 2013: Current season
Portugal	Aqui Há Talento	RTP1	28 January 2007	Sílvia Alberto	Joaquim Monchique Sílvia Rizzo Paulo Dias	Season 1, 2007: Abstractin' (Breakdance)
Portugal	Portugal Tem Talento	SIC	30 January 2011	Bárbara Guimarães	Conceição Lino José Diogo Quintela Ricardo Pais	Season 1, 2011: Filipe Santos (Beatbox)
