Name (year commissioned)	Owner/operator	Length	Maximum diameter	From/to	Licence number
Dampier to Bunbury Natural Gas Pipeline (1984)	Dampier Bunbury Pipeline	1,530km	660 mm	Dampier to Bunbury	PL 40
Goldfields Gas Transmission Pipeline (1996)	GGT Joint venture (APA Group & Others)	1,426km	400 mm	Near Compressor Station 1 to Kalgoorlie	PL 24
Parmelia Pipeline (1971)	APA Group	416 km	356 mm	Dongara to Pinjarra	PL 1
Pilbara Energy Pipeline (1996)	Epic Energy	215 km	450 mm	Karratha to Port Hedland	PL 22
Mid West Gas Pipeline (1999)	APA Group and Western Power	352 km	219 mm	Geraldton to Windimurra	PL 43
Kambalda Esperance Pipeline (2003)	Esperance Pipeline Co	340 km	150 mm	Kambalda to Esperance	PL 59
