Team	Province	Owner(s)	Price	Captain	Head coach	Icon Player
Basnahira Cricket Dundee	Western	Indian Cricket Dundee Limited	$4.33 million	Tillakaratne Dilshan	Duleep Mendis	Tillakaratne Dilshan
Kandurata Warriors	Central	Number One Sports Consulting Private Limited	$4.98 million	Sanath Jayasuriya	Romesh Kaluwitharna	Kumar Sangakkara
Nagenahira Nagas	Eastern	Varun Beverages Lanka Private Limited	$3.22 million	Angelo Mathews	Shane Duff	Angelo Mathews
Ruhuna Royals	Southern	Pearl Overseas Limited	$4.6 million	Lasith Malinga	Waqar Younis	Lasith Malinga
Uthura Rudras	Northern	Rudra Sports Private Limited	$3.4 million	Jehan Mubarak	Tom Moody	Muttiah Muralitharan
Uva Next	Uva	Success Sports Private Limited	$4.6 million	Thilina Kandamby	Naveed Nawaz	Chris Gayle
