Outcome	Year	Championship	Surface	Partner	Opponents	Score
Runner-up	2002	Australian Open	Hard	Fabrice Santoro	Mark Knowles Daniel Nestor	6–7 (4–7) , 3–6
Winner	2003	Australian Open	Hard	Fabrice Santoro	Mark Knowles Daniel Nestor	6–4, 3–6, 6–3
Winner	2004	Australian Open	Hard	Fabrice Santoro	Bob Bryan Mike Bryan	7–6 (7–4) , 6–3
Runner-up	2004	French Open	Clay	Fabrice Santoro	Xavier Malisse Olivier Rochus	5–7, 5–7
Winner	2007	Wimbledon	Grass	Arnaud Clément	Bob Bryan Mike Bryan	6–7 (5–7) , 6–3, 6–4, 6–4
Runner-up	2008	Australian Open	Hard	Arnaud Clément	Jonathan Erlich Andy Ram	5–7, 6–7 (4–7)
