Season	Series	Team	Races	Wins	Poles	F/Laps	Podiums	Points	Position
2008	Asian Formula Renault Challenge	Asia Racing Team	2	0	0	1	0	0	NC†
2008	Formula BMW Pacific	Asia Racing Team	1	0	0	0	0	0	NC†
2009	Asian Formula Renault Challenge	March 3 Racing (1-4) Top Speed Racing Team (5-12)	14	6	4	7	13	293	1st
2009	Formula BMW Pacific	Asia Racing Team	1	0	0	0	0	0	NC†
2010	German Formula Three Championship	Performance Racing	18	0	0	0	0	26	9th
2011	German Formula Three Championship	HS Technik Motorsport	18	0	1	2	2	62	4th
2011	Formula 3 Euro Series	Team HS-Engineering	6	0	0	0	0	0	NC
2011	Austrian Formula Three Series	Team HS-Engineering	2	2	0	0	2	40	8th
