Sec	Offence	Definition, example or notes	Civilian?	Summary Hearing?	Max. sentence at Court Martial
8	Desertion	Being absent without leave to avoid active service	No	No	Life imprisonment
19	Conduct prejudicial to good order and discipline	e.g., Wearing a rank he is not entitled to	No	Yes	Two years' imprisonment
25	Misapplying or wasting public or service property	e.g. Allowing fuel to overflow a tank	No	Yes	Dismissal with disgrace
31	Hazarding a ship	Negligently hazarding a military ship	No	No	Two years' imprisonment
35	Annoyance by flying	Flying an aircraft so as to annoy any person	No	Yes	Dismissal with disgrace
