Date	Location	Fight	Division	Titles	Rematch	TV	Promoter	Notes
November 9	Corpus Christi , USA	Mikey Garcia vs. Roman Martinez	Featherweight	WBO Super Featherweight	No	HBO	Top Rank	Undercard of Donaire/Darchinyan
November 9	Corpus Christi , USA	Nonito Donaire vs. Vic Darchinyan	Super Bantamweight	No	No	HBO	Top Rank	N/A
November 16	Verona , USA	Tomasz Adamek vs. Vyacheslav Glazkov	Heavyweight	No	No	NBC	Matchroom Boxing	N/A
November 24	Macau	Manny Pacquiao vs. Brandon Rios	Welterweight	No	No	HBO PPV	Top Rank	N/A
November 30	Quebec City , Canada	Sergey Kovalev vs. Ismayl Sillakh	Light Heavyweight	WBO Light Heavyweight	No	HBO	GYM Promotions	Undercard of Stevenson/Bellew
November 30	Quebec City , Canada	Adonis Stevenson vs. Tony Bellew	Light Heavyweight	WBC Light Heavyweight	No	HBO	GYM Promotions	N/A
November 30	San Antonio , USA	Devon Alexander vs. Shawn Porter	Welterweight	IBF Welterweight	No	Showtime	Golden Boy Promotions	N/A
December 14	Bamberg , Germany	Yoan Pablo Hernández vs. Alexander Alekseev	Cruiserweight	IBF Cruiserweight The Ring Magazine Cruiserweight	No	Das Erste	Sauerland	N/A
