-	Episode title	Romanized title	Translation of title	Broadcast date	Ratings
Ep. 2	学院一自慢の生徒は使用人	Gakuin ichi jiman no seito wa shiyōnin	The school boasts of one student-servant	October 24, 2009	8.0%
Ep. 3	お姫様の友達はネズミだけ	Ohimesama no tomodachi wa nezumi dakee	Rats are the only friends of the princess	October 31, 2009	7.8%
Ep. 4	主演女優は私よ!	Shuen joyū wa watashi yo!	I am the main starring actress!	November 7, 2009	7.6%
Ep. 6	小悪魔系天使あらわる!	Shōakuma kei tenshi ara waru!	The little devil turns into a little angel!	November 21, 2009	8.4%
Ep. 7	誰も盗めない宝物	Dare mo nusumenai takaramono	Who stole my treasure	November 28, 2009	8.4%
Ep. 8	魔法のようなプレゼント	Mahō no yōna purezento	A magical gift	December 5, 2009	7.0%
Ep. 9	彼女を救うのはだれだ?	Kanojo o sukuu no wa dareda?	'Who is able to rescue that girl?	December 12, 2009	9.8%
