Outcome	Year	Championship	Surface	Partner	Opponents	Score
Runner-up	2007	Charleston	Clay (Green)	Sun Tiantian	Yan Zi Jie Zheng	5–7, 0–6
Winner	2009	Rome	Clay	Hsieh Su-wei	Daniela Hantuchová Ai Sugiyama	7–5, 7–6 (7–5)
Winner	2009	Beijing	Hard	Hsieh Su-wei	Alla Kudryavtseva Ekaterina Makarova	6–3, 6–1
Runner-up	2010	Tokyo	Hard (i)	Shahar Pe'er	Iveta Benešová Barbora Záhlavová-Strýcová	4–6, 6–4, [8–10]
Winner	2011	Rome	Clay	Jie Zheng	Vania King Yaroslava Shvedova	6–2, 6–3
Winner	2013	Rome	Clay	Hsieh Su-wei	Sara Errani Roberta Vinci	4–6, 6–3, [10–8]
