Outcome	Year	Championship	Surface	Partner	Opponents	Score
Runner-up	2005	Rome , Italy	Clay	Anabel Medina Garrigues	Cara Black Liezel Huber	6–0, 4–6, 6–1
Runner-up	2008	Montréal , Canada	Hard	Flavia Pennetta	Cara Black Liezel Huber	6–1, 6–1
Runner-up	2009	Dubai , United Arab Emirates	Hard	Agnieszka Radwańska	Cara Black Liezel Huber	6–3, 6–3
Winner	2010	Cincinnati , United States	Hard	Victoria Azarenka	Lisa Raymond Rennae Stubbs	7–6 (7-4) , 7–6 (10-8)
Winner	2011	Madrid , Spain	Clay	Victoria Azarenka	Květa Peschke Katarina Srebotnik	6–4, 6–3
Runner-up	2011	Toronto , Canada	Hard	Victoria Azarenka	Liezel Huber Lisa Raymond	w/o
