Season	Host	Mens Singles	Womens Singles	Mens Doubles	Womens Doubles
1995/96	Kettering	Kong Linghui	Yang Ying	Werner Schlager Karl Jindrak	Yang Ying Wang Hui
1996/97	Kettering	Jean-Michel Saive	Chen-Tong Fei-Ming	Christophe Legout Patrick Chila	Chai Po Wa Qiao Yunping
1998/99	Hopton-on-Sea	Ma Wenge	Jie Schoepp	Trinko Keen Danny Heister	Lee Eun-Sil Ryu Ji-Hae
2000/01	Chatham	Wang Liqin	Yoshie Takada	Timo Boll Zoltan Fejer-Konnerth	Kim Hyang Mi Kim Hyon Hui
2008/09	Sheffield	Ma Long	Guo Yan	Ma Long Wang Liqin	Kim Kyung Ah Park Mi Young
