Date	Result	Score	Stadium	City	Crowd
13 June 1997	Adelaide Rams def. Leeds Rhinos	34-8	Adelaide Oval	Adelaide	14,630
13 June 1997	Hunter Mariners def. Castleford Tigers	42-12	Wheldon Road	Castleford	3,087
14 June 1997	North Queensland Cowboys def. Oldham Bears	54-16	Stockland Stadium	Townsville	12,631
14 June 1997	Auckland Warriors def. Bradford Bulls	20-16	Odsal Stadium	Bradford	13,133
15 June 1997	Canterbury Bulldogs def. Halifax Blue Sox	58-6	Belmore	Sydney	5,034
15 June 1997	Canberra Raiders def. London Broncos	66-20	Bruce Stadium	Canberra	6,471
15 June 1997	Sheffield Eagles def. Perth Reds	26-22	Don Valley Stadium	Sheffield	3,000
15 June 1997	Penrith Panthers def. Warrington Wolves	52-22	Wilderspool	Warrington	3,850
16 June 1997	Brisbane Broncos def. Wigan Warriors	34-0	ANZ Stadium	Brisbane	14,833
