Date	Tournament	Surface	Partner	Opponents in the final	Score
6 February 2005	Viña del Mar , Chile	Clay	David Ferrer	Gastón Etlis Martín Rodríguez	6–3, 6–4
27 February 2005	Acapulco , Mexico	Clay	David Ferrer	Jiří Vaněk Tomáš Zíb	4–6, 6–1, 6–4
24 May 2008	Casablanca , Morocco	Clay	Albert Montañés	James Cerretani Todd Perry	6–1, 6–2
10 January 2010	Chennai , India	Hard	Marcel Granollers	Lu Yen-hsun Janko Tipsarević	7–5, 6–2
8 May 2010	Munich , Germany	Clay	Oliver Marach	Eric Butorac Michael Kohlmann	5–7, 6–3, [16–14]
