Episode	Air Date	Timeslot	Viewers	Weekly Rank for Living
"Pilot"	September 22, 2008	Monday, 10:00pm	238,000	4
"Chapter Two: Nothing Sacred"	September 29, 2008	Monday, 10:00pm	139,000	7
"Chapter Three: Pink Poison"	October 6, 2008	Monday, 10:00pm	TBC	TBC
"Chapter Four: Bombay Highway"	October 13, 2008	Monday, 10:00pm	183,000	5
"Chapter Five: Dressed to Kill"	October 20, 2008	Monday, 10:00pm	214,000	8
"Chapter Six: Take the High Road"	October 27, 2008	Monday, 10:00pm	TBC	TBC
"Chapter Seven: Carpe Threesome"	November 3, 2008	Monday, 10:00pm	178,000	6
