Outcome	Date	Surface	Partner	Opponents	Score
Winner	5 February 2012	Hard (i)	Nicolas Mahut	Paul Hanley Jamie Murray	6–4, 7–6 (7–4)
Winner	20 February 2012	Hard (i)	Nicolas Mahut	Dustin Brown Jo-Wilfried Tsonga	3–6, 6–3, [10–6]
Winner	17 September 2012	Hard (i)	Nicolas Mahut	Johan Brunström Frederik Nielsen	7–6 (7–3) , 6–4
Winner	15 July 2013	Grass	Nicolas Mahut	Tim Smyczek Rhyne Williams	6–7 (4–7) , 6–2, [10–5]
Runner-up	20 July 2013	Hard	Igor Sijsling	Purav Raja Divij Sharan	6–7 (4–7) , 6–7 (3–7)
Winner	29 July 2013	Hard	Igor Sijsling	Colin Fleming Jonathan Marray	7–6 (8–6) , 6–3
Winner	6 October 2013	Hard	Rohan Bopanna	Jamie Murray John Peers	7-6 (7-5) , 6-4
