University	Location	Year of Foundation	University Status	THE World University Rankings 2012-13	Academic Ranking of World Universities 2012	QS World University Rankings 2012
Curtin University	Perth , WA	1902	1986	Not Ranked	401-500	258
Queensland University of Technology	Brisbane , QLD	1908	1989	251-275	Not Ranked	281
Royal Melbourne Institute of Technology	Melbourne , Vic	1887	1992	Not Ranked	Not Ranked	246
University of South Australia	Adelaide , SA	1856	1991	301-350	Not Ranked	293
University of Technology, Sydney	Sydney , NSW	1843	1988	351-400	401-500	284
