Year	Title	Role	Cast	Live / Studio	Label
1981	Meyerbeer : Gli amori di Teolinda (cantata)	—	Nicolesco	Live	Pro Arte
1983	Puccini : La rondine	Lisette	Te Kanawa Domingo, Nicolesco, Nucci, et al.	Live	CBS Records
1987	Bellini : Beatrice di Tenda	Beatrice di Tenda	Nicolesco, Toczyska, Cappuccilli, La Scola, et al.	Live	Rizzoli Records Sony 1995, 2009
1987	Mozart : The Marriage of Figaro	Marcellina	Hynninen Price, Battle, Nicolesco, et al.	Live	EMI
1987	Ravel : Alyssa and Alcyone (cantatas)	—	Nicolesco, Denize, Meens, Glashof	Live	Rizzoli Records
1988	Donizetti : Maria di Rohan	Maria	Nicolesco, Morino, Coni, Franci, et al.	Live	Nuova Era reissued 1991
1990	Verdi : Simon Boccanegra	Maria Boccanegra	Bruson Nicolesco, Sabbatini, Scandiuzzi, et al.	Live	Capriccio reissued 2005
