Year	Award	Category	Motive	Result
2006	MVPA Award	Directorial Debut of the Year	Switchfoot - " Stars "	Won
2007	Premios Lo Nuestro	"Video of the Year"	Belinda - " Ni Freud Ni Tu Mama "	Nominated
2007	MTV Video Music Awards Latin America	"Video of the Year"	Belinda - " Bella Traición "	Won
2007	OVMALA	"Best Lighting"	Belinda - " Luz Sin Gravedad "	Won
2007	OVMALA	"Best Costume in a Video (Women)"	Belinda - " Bella Traición "	Nominated
2007	OVMALA	"Best Female Video"	Belinda - " Luz Sin Gravedad "	Won
