Date	Tournament	Winning score	Margin of victory	Runner(s)-up
10 Mar 2002	Jacob's Creek Open Championship	–9 (71-69-67-72=279)	2 strokes	Bryce Molder
29 Feb 2004	New Zealand PGA Championship	–6 (70-72-72-68=282)	3 strokes	Bradley Hughes , Brendan Jones Bill Lunde
3 Sep 2006	Legend Financial Group Classic	–10 (67-71-68-68=274)	1 stroke	Bradley Hughes
30 Mar 2008	Chitimacha Louisiana Open	–12 (70-66-66-70=272)	1 strokes	Kyle Thompson
23 Oct 2011	Winn-Dixie Jacksonville Open	–6 (70-64-69-71=274)	1 stroke	Jonas Blixt
