Date	Tournament	Surface	Partnering	Opponents in the final	Score
August 4, 1991	Kitzbühel , Austria	Clay	Tomás Carbonell	Pablo Arraya Dimitri Poliakov	6–7, 6–2, 6–4
November 15, 1992	São Paulo , Brazil	Clay	Diego Pérez	Christer Allgardh Carl Limberger	6–2, 7–6
October 11, 1992	Athens , Greece	Clay	Tomás Carbonell	Marcelo Filippini Mark Koevermans	6–3, 6–4
August 28, 1994	Umag , Croatia	Clay	Diego Pérez	Karol Kučera Paul Wekesa	6–2, 6–4
March 28, 1995	Casablanca , Morocco	Clay	Tomás Carbonell	Emanuel Couto João Cunha e Silva	6–4, 6–1
June 16, 1995	Oporto , Portugal	Clay	Tomás Carbonell	Jordi Arrese Àlex Corretja	6–3, 7–6
July 23, 1995	Stuttgart Outdoor , Germany	Clay	Tomás Carbonell	Ellis Ferreira Jan Siemerink	3–6, 6–3, 6–4
October 8, 1995	Valencia , Spain	Clay	Tomás Carbonell	Tom Kempers Jack Waite	7–5, 6–3
April 14, 1996	Estoril , Portugal	Clay	Tomás Carbonell	Tom Nijssen Greg Van Emburgh	6–3, 6–2
