Name	Born – Died	Notable for	Connection with Australia	Connection with America
John Butler	1975–	lead singer for the John Butler Trio	family moved to Australia at age 11	born in the U.S.; mother is U.S. citizen
Flea	1962–	bassist for Red Hot Chili Peppers	born in Australia	lived in the U.S. since age 5
MC Lars	1982–	rapper	father is Australian	born in the U.S.
Olivia Newton-John	1948–	pop singer	family moved to Australia at age 6	lives in the U.S.
Rick Springfield	1949–	singer and actor	born in Australia	lives in the U.S.
Mark Stoermer	1977–	bassist for The Killers	father is Australian	born in the U.S.
