Outcome	Date	Tournament	Surface	Partner	Opponents	Score
Runner-up	19 May 2009	Antalya , Turkey	Clay	Julia Klackenberg	Amanda Carreras Valentina Sulpizio	0–6, 3–6
Runner-up	22 June 2009	Kristinehamn , Sweden	Clay	Sofia Arvidsson	Hanne Skak Jensen Johanna Larsson	6–7 (5–7) , 2–6
Winner	29 June 2009	Ystad , Sweden	Clay	Sofia Arvidsson	Melanie Klaffner Hanna Nooni	6–4, 6–4
Winner	27 July 2009	Tampere , Finland	Clay	Emma Laine	Alizé Lim Vivienne Vierin	6–4, 6–3
Winner	7 May 2012	Båstad , Sweden	Clay	Eveliina Virtanen	Hilda Melander Paulina Milosavljevic	6–2, 3–6, [10–7]
Winner	14 May 2012	Båstad , Sweden	Clay	Eveliina Virtanen	Lucy Brown Milana Špremo	6–3, 6–7 (4–7) , [10–6]
Winner	18 March 2013	Sunderland , United Kingdom	Hard (i)	Hilda Melander	Amy Bowtell Lucy Brown	6–0, 6–3
