Outcome	Date	Tournament	Surface	Partner	Opponents in the final	Score
Winner	17 March 2007	Cairo	Clay	Zuzana Kučová	Melissa Berry Michelle Gerards	6–7 (3) 6–4 6–3
Winner	20 May 2007	Michalovce	Clay	Klaudia Boczová	Olga Brózda Justyna Jegiołka	7–5 4–6 6–3
Runner-up	11 May 2008	Jounieh	Clay	Stefanie Vögele	Nina Bratchikova Veronika Kapshay	5–7, 6–3, [6–10]
Winner	25 May 2008	Galați	Clay	Valentina Sulpizio	Alexandra Cadanțu Antonia Xenia Tout	6–0 6–2
Runner-up	3 May 2009	Johannesburg	Hard	Anastasija Sevastova	Naomi Cavaday Lesia Tsurenko	2–6 6–2 [9–11]
Winner	14 June 2009	Zlín	Clay	Zuzana Kučová	Nikola Fraňková Carmen Klaschka	6–3 6–4
