Round	Race name	Circuit	City/State	Date	Winner(s)	Team
1	Better Brakes 300	Amaroo Park	Sydney , New South Wales	3 August	Jim Richards	JPS Team BMW
2	BP Plus 300	Surfers Paradise	Surfers Paradise , Queensland	24 August	George Fury Glenn Seton	Peter Jackson Nissan Racing
3	Castrol 500	Sandown	Melbourne , Victoria	14 September	George Fury Glenn Seton	Peter Jackson Nissan Racing
4	James Hardie 1000	Mount Panorama	Bathurst , New South Wales	5 October	Allan Grice Graeme Bailey	Chickadee Chicken
5	The Sun South Pacific 300	Calder Park	Melbourne, Victoria	19 November	George Fury Glenn Seton	Peter Jackson Nissan Racing
6	Pepsi 300	Oran Park	Sydney, New South Wales	8 December	George Fury	Peter Jackson Nissan Racing
