Episode Number	Air Date	Guest Host	Who knows the most about the guest host? panelists	Coat Of Cash Wearing Celebrity
1	5 January 2007	David Tennant	Amy Winehouse and George Galloway	Lauren Harries
2	12 January 2007	Tamzin Outhwaite	Kate Thornton and Tito Jackson	Bradley McIntosh
3	19 January 2007	James Nesbitt	Leo Sayer and Kirstie Allsopp	Shahbaz Chauhdry
4	26 January 2007	Noel Edmonds	Kelly Osbourne and Jason Donovan	Jason Donovan
5	2 February 2007	Jamie Oliver	Jermaine Jackson and Nora Sands	Ian "H" Watkins
6	9 February 2007	Steven Seagal	Gemma Atkinson and Jamelia	Steven Seagal
7	16 February 2007	Ashley Jensen	Duncan James and Kim Woodburn	Alan Carr
