Year	Team	Co-Drivers	Class	Laps	Pos.	Class Pos.
1997	La Filière Elf	Henri Pescarolo Emmanuel Clérico	LMP	319	7th	4th
1998	Courage Compétition	Didier Cottaz Marc Goossens	LMP1	232	DNF	DNF
1999	Viper Team Oreca	David Donohue Soheil Ayari	GTS	271	DNF	DNF
2000	Mopar Team Oreca	Yannick Dalmas Nicolas Minassian	LMP900	1	DNF	DNF
2001	Larbre Compétition	Christophe Bouchut Tiago Monteiro	GTS	234	20th	4th
2002	Equipe de France FFSA Oreca	Jonathan Cochet Benoît Tréluyer	GTS	326	14th	3rd
2007	Team Oreca	Laurent Groppi Nicolas Prost	GT1	337	10th	5th
2011	Larbre Compétition	Christophe Bourret Pascal Gibon	GTE Am	301	21st	2nd
2012	Larbre Compétition	Christophe Bourret Pascal Gibon	GTE Am	309	28th	5th
