Province	Area (km 2 )	Total population (2000 census)	Total population (2005 estimate)	Total population (2010 census)
West Kalimantan (Kalimantan Barat)	147,307.00	4,016,353	4,042,817	4,393,239
Central Kalimantan (Kalimantan Tengah)	153,564.50	1,801,965	1,913,026	2,202,599
South Kalimantan (Kalimantan Selatan)	38,744.23	2,984,026	3,271,413	3,626,119
East Kalimantan (Kalimantan Timur)	204,534.34	2,451,895	2,840,874	3,550,586
North Kalimantan (Kalimantan Utara)	71,176.72	—	473,424	524,526
Total	615,326.79	11,254,239	12,541,554	14,297,069
