Outcome	Date	Tournament	Surface	Partner	Opponents	Score
Runner-up	29 July 2001	Orange Warsaw Open , Sopot, Poland	Clay	Anastasia Rodionova	Joannette Kruger Francesca Schiavone	6–4, 6–0
Winner	12 October 2003	Tashkent Open , Tashkent, Uzbekistan	Hard	Tatiana Poutchek	Ting Li Tian-Tian Sun	6–3, 7–6(0)
Winner	7 July 2005	Internazionali di Modena , Modena, Italy	Clay	Mervana Jugić-Salkić	Gabriela Navrátilová Michaela Paštiková	6–2, 6–0
Runner-up	24 September 2006	Sunfeast Open , Kolkata, India	Hard	Yuliana Fedak	Liezel Huber Sania Mirza	6–4, 6–0
Runner-up	15 February 2009	Pattaya Women's Open , Pattaya City, Thailand	Hard	Vitalia Diatchenko	Tamarine Tanasugarn Yaroslava Shvedova	6–3, 6–2
