Tournament	Surface	Week	Winner	Finalist	Semifinalists
Tokyo	Carpet (i)	January 28	Martina Hingis 7–6(6), 4–6, 6–3	Monica Seles	Silvia Farina Elia Anna Kournikova
Indian Wells	Hard	March 4	Daniela Hantuchová 6–3, 6–4	Martina Hingis	Emmanuelle Gagliardi Monica Seles
Miami	Hard	March 18	Serena Williams 7–5, 7–6(4)	Jennifer Capriati	Monica Seles Venus Williams
Charleston	Clay	April 15	Iva Majoli 7–6(5), 6–4	Patty Schnyder	Jennifer Capriati Sandrine Testud
Berlin	Clay	May 6	Justine Henin 6–2, 1–6, 7–6(5)	Serena Williams	Jennifer Capriati Anna Pistolesi
Rome	Clay	May 13	Serena Williams 7–6(6), 6–4	Justine Henin	Kim Clijsters Jennifer Capriati
Canada (Montréal)	Hard	August 12	Amélie Mauresmo 6–4, 6–1	Jennifer Capriati	Daniela Hantuchová Jelena Dokić
Moscow	Carpet (i)	September 30	Magdalena Maleeva 5–7, 6–3, 7–6(4)	Lindsay Davenport	Amélie Mauresmo Amanda Coetzer
Zurich	Carpet (i)	October 14	Patty Schnyder 6–7(5), 7–6(8), 6–3	Lindsay Davenport	Conchita Martínez Justine Henin
