Year	Team	Co-Drivers	Class	Laps	Pos.	Class Pos.
1997	GT1 Lotus Racing	Jan Lammers Alexander Grau	GT1	121	DNF	DNF
2000	Carsport Holland	David Hart Hans Hugenholtz	GTS	317	13th	6th
2002	Team Carsport Holland Racing Box	Gabriele Matteuzzi Anthony Kumpen	GTS	93	DNF	DNF
2003	Carsport America	Anthony Kumpen David Hart	GTS	10	DNF	DNF
2004	Barron Connor Racing	Ange Barde Jean-Denis Délétraz	GTS	200	DNF	DNF
2006	Spyker Squadron	Jeroen Bleekemolen Jonny Kane	GT2	202	DNF	DNF
2007	Spyker Squadron	Jaroslav Janiš Jonny Kane	GT2	70	DNF	DNF
2008	IPB Spartak Racing Reiter Engineering	Peter Kox Roman Rusinov	GT1	266	NC	NC
