Reservation	Location	1969	1979	1989	2000
Navajo Indian Reservation	Arizona, New Mexico, and Utah	62.1	47.3	54.2	46.5
Cheyenne River Indian Reservation	South Dakota	54.8	47.5	57.2	42.3
Standing Rock Indian Reservation	South Dakota and North Dakota	58.3	44.2	54.9	41.2
Crow Indian Reservation	Montana	40.0	29.6	45.5	31.5
Wind River Indian Reservation	Wyoming	42.0	35.2	47.8	22.6
Pine Ridge Indian Reservation	South Dakota	54.3	48.4	59.5	52.8
Fort Peck Indian Reservation	Montana	46.7	26.8	42.8	38.5
San Carlos Indian Reservation	Arizona	62.3	45.9	59.8	52.6
