Outcome	Date	Tournament	Surface	Partner	Opponents in the final	Score
Runner–up	15 September 2006	Torre del Greco	Clay	Emilia Desiderio	Andreea Roxana Vaideanu Erika Zanchetta	1–6, 6–1, 1–6
Winner	23 September 2006	Lecce	Clay	Ekaterina Ivanova	Kildine Chevalier Adriana Serra Zanetti	7–6 (7–4) , 6–4
Winner	22 October 2006	Dubrovnik	Clay	Ana Veselinović	Ana Jovanović Polona Reberšak	6–4, 7–5
Winner	29 October 2006	Dubrovnik	Clay	Stefanie Haidner	Aleksandra Lukič Patricia Vollmeier	6–4, 6–3
Runner–up	1 April 2007	Hammond	Hard	Marie-Ève Pelletier	Chan Chin-wei Tetiana Luzhanska	1–6, 6–7 (3–7)
Runner–up	9 June 2007	Zagreb	Clay	Danica Krstajić	Ana Jovanović Anastasia Poltoratskaya	6–0, 4–6, 1–6
Winner	23 June 2007	Fontanafredda	Clay	Mervana Jugić-Salkić	Carmen Klaschka Magda Mihalache	6–2, 6–1
Winner	29 June 2007	Sarajevo	Clay	Karolina Jovanović	Katarína Poljaková Zuzana Zlochová	6–1, 6–0
Winner	5 July 2007	Båstad	Clay	Hanna Nooni	Mervana Jugić-Salkić Anna Koumantou	7–5, 7–5
Winner	27 October 2007	Saint Denis	Hard	Marinne Giraud	Florence Haring Virginie Pichet	6–2, 7–5
Winner	2 December 2007	Beloura Sintra	Clay	Caroline Maes	Neuza Silva Roxane Vaisemberg	6–4, 6–1
Winner	21 March 2008	Noida	Hard	Lenka Tvarošková	Kelly Anderson Chanelle Scheepers	6–2, 6–7 (7–9) , [10–6]
Runner–up	14 May 2008	Szczecin	Clay	Emma Laine	Iveta Gerlová Tereza Hladíková	1–6, 4–6
Winner	24 May 2008	Moscow	Clay	Emma Laine	Maria Kondratieva Oksana Teplyakova	7–6 (7–5) , 6–2
Winner	21 June 2008	Istanbul	Hard	Lenka Tvarošková	Stefania Boffa Nikola Fraňková	7–5, 7–6 (7–4)
Winner	27 July 2008	Les Contamines	Hard	Mervana Jugić-Salkić	Justine Ozga Darina Šeděnková	6–1, 6–4
Runner–up	15 August 2008	Palić	Clay	Mervana Jugić-Salkić	Olga Brózda Magdalena Kiszczyńska	3–6, 5–7 (6–8)
Winner	30 August 2008	Vlaardingen	Clay	Mervana Jugić-Salkić	Irina Kuzmina Anastasia Poltoratskaya	6–1, 6–2
Winner	22 November 2008	Phoenix	Hard	Lenka Tvarošková	Kelly Anderson Natalie Grandin	6–4, 3–6, [10–4]
Winner	12 April 2009	Šibenik	Clay	Nataša Zorić	Tina Obrez Mika Urbančič	6–0, 6–3
Winner	17 July 2009	Rome	Clay	María Irigoyen	Elisa Balsamo Stefania Chieppa	7–5, 6–2
Winner	5 September 2009	Brčko	Clay	Ana Jovanović	Patricia Chirea Petra Pajalič	6–4, 6–1
Runner–up	13 September 2009	Denain	Clay	Magdalena Kiszchzynska	Elena Chalova Ksenia Lykina	4–6, 3–6
Runner–up	10 October 2009	Podgorica	Clay	Karolina Jovanović	Nicole Clerico Karolina Kosińska	7–6 (7–4) , 4–6, [4–10]
Runner–up	25 April 2010	Dothan	Clay	María Irigoyen	Alina Jidkova Anastasia Yakimova	4–6, 2–6
Winner	12 June 2010	Budapest	Clay	Lenka Wienerová	Anna Livadaru Florencia Molinero	6–4, 6–1
Winner	2 July 2010	Toruń	Clay	Marija Mirkovic	Katarzyna Piter Barbara Sobaszkiewicz	4–6, 6–2, [10–5]
Winner	10 July 2010	Aschaffenburg	Clay	Erika Sema	Elena Bogdan Andrea Koch Benvenuto	7–6 (7–4) , 2–6, [10–8]
Runner–up	6 August 2010	Moscow	Clay	Marija Mirkovic	Nadejda Guskova Valeria Solovyeva	6–7 (5–7) , 3–6
Runner–up	15 January 2011	Glasgow	Hard (i)	Jasmina Tinjić	Ulrikke Eikeri Isabella Shinikova	4–6, 4–6
Winner	12 February 2011	Antalya	Clay	Maria Shamayko	Sultan Gönen Anna Karavayeva	6–4, 6–4
Runner–up	29 April 2011	Minsk	Hard (i)	Nicole Rottmann	Lyudmyla Kichenok Nadiya Kichenok	1–6, 2–6
Winner	18 June 2011	Istanbul	Hard	Marta Domachowska	Daniella Dominikovic Melis Sezer	6–4, 6–2
Winners	10 September 2011	Saransk	Clay	Mihaela Buzărnescu	Eva Hrdinová Veronika Kapshay	6–3, 6–1
Runner–up	19-Mar-2012	Antalya	Clay	Claudia Giovine	Evelyn Mayr (ITA) Julia Mayr	2-6,3-6
Winner	23-Apr-2012	San Severo	Clay	Anastasia Grymalska	Chiara Mendo Giulia Sussarello	6-2 6-4
Winners	26 May 2012	Timișoara , Romania	Clay	Andreea Mitu	Lina Gjorcheska Dalia Zafirova	6–1, 6–2
Runner–up	04-Jun-2012	Karshi , UZBEKISTAN	Clay	Veronika Kapshay	Valentyna Ivakhnenko Kateryna Kozlova	5-7,3-6
Winners	25-Jun-2012	Izmir , TURKEY	Hard	Ana Bogdan	Abbie Myers Melis Sezer	6-3, 3-0 RET
Runner–up	25-Jun-2012	Mestre , ITA	Clay	Reka-Luca Jani	Mailen Auroux Maria Irigoyen	7-5,4-6 8-10
Runner–up	04-Feb-2013	Antalya , TURKEY	Clay	Ana Bogdan	Giulia Bruzzone Martina Caregaro	3-6,6-1 6-10
Winners	11-Feb-2013	Antalya , TURKEY	Clay	Raluca Elena Platon	Ekaterine Gorgodze Sofia Kvatsabaia	1-6 4-5 RET
Winners	01-Apr-2013	Heraklion , GRE	Carpet	Vivien Juhaszova	Giulia Sussarello Sara Sussarello	7-5 6-7 (7) 10-4
Winners	08-Apr-2013	Heraklion , GRE	Carpet	Marina Melnikova	Giulia Sussarello Despina Papamichail	6-1 6-4
Winner	13 May 2013	Balikpapan , Indonesia	Hard	Naomi Broady	Chen Yi Xu Yifan	6–3, 6–3
Winner	20 May 2013	Tarakan , Indonesia	Hard (i)	Naomi Broady	Tang Haochen Tian Ran	6–2, 1–6, [10–5]
Runner–up	03-Jun-2013	Karshi , Uzbekıstan	Clay	Veronika Kapshay	Margarita Gasparyan Polina Pekhova	2-6,1-6
Winner	16 September 2013	Dobrich , Bulgaria	Clay	Xenia Knoll	Isabella Shinikova Dalia Zafirova	7-5, 7–6(7–5)
