Elimination	Wrestler	Team	Eliminated by	Elimination move	Time
1	Greg Valentine	The Original Dream Team	Necro Butcher	Pinfall after a Sunset flip	n/a
2	Axl Rotten	Bad Breed	Samu and Alofa	Pinfall after a Double falling headbutt	n/a
3	Samu	The Headshrinkers	Tito Santana	Pinfall after a Schoolboy	n/a
4	Zach Gowen	Pimp & Gimp Connection	Doug Basham	Pinfall after a Diving headbutt	n/a
5	Jorge Santana	Tito and Jorge Santana	Brute Issei	Pinfall after an STO	n/a
6	Brute Issei	Team All Japan	Doug Basham	Pinfall after the Last Impression	n/a
7	Doug Basham	The Basham Brothers	Mad Man Pondo	Pinfall after the Stop Sign Smash	n/a
Winners:	Mad Man Pondo and Necro Butcher	Mad Man Pondo and Necro Butcher	Mad Man Pondo and Necro Butcher	Mad Man Pondo and Necro Butcher	Mad Man Pondo and Necro Butcher
