Battle No.	Broadcast Date	Name of Battle	Theme	Celebrities Taking Part	Winner	Runner-up	Notes
1	21 November	The Big Drip	Tactics	Martina, Joe & David	Joe	Martina	None
2	22 November	Hog Roast	Stamina	Simon, Brian & Carly	Carly & Simon	Brian	See below
3	23 November	Down To The Wire	Concentration	Esther, George & Dani	Dani	Esther	None
4	24 November	Up To Your Neck In It	Patience	Robert, Nicola & Timmy	Timmy	Nicola	None
5	25 November	Night of the Living Bed	Endurance	Nicola, Martina, Brian, Esther	Esther	Brian	None
